{
  "schema_version": "1.0",
  "generated_at": "2026-07-19T14:59:45+08:00",
  "environment": {
    "os": "Darwin",
    "os_version": "25.3.0",
    "architecture": "x86_64",
    "python": "3.9.6",
    "node": "v26.4.0",
    "java": "The operation couldn’t be completed. Unable to locate a Java Runtime.",
    "working_directory": "pptxgenjs",
    "containerized": false
  },
  "builders": {
    "officecli": {
      "available": false,
      "version": null,
      "command": null,
      "features": {
        "native_text": "unknown",
        "native_table": "unknown",
        "native_chart": "unknown",
        "native_connector": "unknown",
        "svg_embed": "unknown",
        "speaker_notes": "unknown",
        "theme": "unknown",
        "slide_master": "unknown",
        "readback": "unknown"
      },
      "components": {},
      "warnings": [
        "officecli command not found."
      ],
      "errors": []
    },
    "pptxgenjs": {
      "available": true,
      "version": "4.0.1",
      "command": "node",
      "features": {
        "native_text": true,
        "native_table": true,
        "native_chart": true,
        "native_connector": true,
        "svg_embed": true,
        "speaker_notes": true,
        "theme": "partial",
        "slide_master": "partial",
        "readback": false
      },
      "components": {
        "judgment_title": "full",
        "section_title": "full",
        "body_argument": "full",
        "evidence_block": "full",
        "quote_block": "full",
        "source_note": "full",
        "metric_card": "full",
        "comparison_card": "full",
        "risk_card": "full",
        "capability_card": "full",
        "summary_action_card": "full",
        "native_table": "full",
        "comparison_matrix": "full",
        "decision_matrix": "full",
        "feature_matrix": "full",
        "risk_matrix": "full",
        "bar_chart": "full",
        "line_chart": "full",
        "pie_chart": "full",
        "waterfall_chart": "partial",
        "scatter_chart": "partial",
        "kpi_dashboard": "full",
        "timeline": "full",
        "process_flow": "full",
        "process_lane": "full",
        "swimlane": "partial",
        "issue_tree": "full",
        "decision_tree": "full",
        "layered_architecture": "partial",
        "hub_spoke": "full",
        "ecosystem_map": "partial",
        "capability_landscape": "partial",
        "dependency_graph": "partial",
        "flywheel": "partial",
        "causal_chain": "full",
        "zoned_ecosystem": "partial",
        "data_flow": "partial",
        "state_transition": "full",
        "conceptual_scene": "visual_only",
        "editorial_illustration": "visual_only",
        "brand_character_scene": "visual_only",
        "material_background": "visual_only",
        "complex_infographic": "partial"
      },
      "warnings": [],
      "errors": []
    },
    "python_pptx": {
      "available": true,
      "version": "1.0.2",
      "command": "/Library/Developer/CommandLineTools/usr/bin/python3",
      "features": {
        "native_text": true,
        "native_table": true,
        "native_chart": false,
        "native_connector": "partial",
        "svg_embed": false,
        "speaker_notes": false,
        "theme": "partial",
        "slide_master": "partial",
        "readback": true
      },
      "components": {
        "judgment_title": "full",
        "section_title": "full",
        "body_argument": "full",
        "evidence_block": "full",
        "quote_block": "full",
        "source_note": "full",
        "metric_card": "full",
        "comparison_card": "full",
        "risk_card": "full",
        "capability_card": "full",
        "summary_action_card": "full",
        "native_table": "full",
        "comparison_matrix": "full",
        "decision_matrix": "full",
        "feature_matrix": "full",
        "risk_matrix": "full",
        "bar_chart": "partial",
        "line_chart": "partial",
        "pie_chart": "partial",
        "waterfall_chart": "unsupported",
        "scatter_chart": "unsupported",
        "kpi_dashboard": "partial",
        "timeline": "full",
        "process_flow": "full",
        "process_lane": "full",
        "swimlane": "partial",
        "issue_tree": "full",
        "decision_tree": "full",
        "layered_architecture": "partial",
        "hub_spoke": "full",
        "ecosystem_map": "partial",
        "capability_landscape": "partial",
        "dependency_graph": "partial",
        "flywheel": "partial",
        "causal_chain": "full",
        "zoned_ecosystem": "partial",
        "data_flow": "partial",
        "state_transition": "partial",
        "conceptual_scene": "visual_only",
        "editorial_illustration": "visual_only",
        "brand_character_scene": "visual_only",
        "material_background": "visual_only",
        "complex_infographic": "partial"
      },
      "warnings": [],
      "errors": []
    },
    "html_svg": {
      "available": true,
      "version": "python-stdlib-svg",
      "command": "python",
      "features": {
        "native_text": false,
        "native_table": false,
        "native_chart": false,
        "native_connector": false,
        "svg_embed": true,
        "speaker_notes": false,
        "theme": false,
        "slide_master": false,
        "readback": false
      },
      "components": {
        "judgment_title": "visual_only",
        "section_title": "visual_only",
        "body_argument": "visual_only",
        "evidence_block": "visual_only",
        "quote_block": "visual_only",
        "source_note": "visual_only",
        "metric_card": "visual_only",
        "comparison_card": "visual_only",
        "risk_card": "visual_only",
        "capability_card": "visual_only",
        "summary_action_card": "visual_only",
        "native_table": "visual_only",
        "comparison_matrix": "visual_only",
        "decision_matrix": "visual_only",
        "feature_matrix": "visual_only",
        "risk_matrix": "visual_only",
        "bar_chart": "visual_only",
        "line_chart": "visual_only",
        "pie_chart": "visual_only",
        "waterfall_chart": "visual_only",
        "scatter_chart": "visual_only",
        "kpi_dashboard": "visual_only",
        "timeline": "visual_only",
        "process_flow": "visual_only",
        "process_lane": "visual_only",
        "swimlane": "visual_only",
        "issue_tree": "visual_only",
        "decision_tree": "visual_only",
        "layered_architecture": "visual_only",
        "hub_spoke": "visual_only",
        "ecosystem_map": "visual_only",
        "capability_landscape": "visual_only",
        "dependency_graph": "visual_only",
        "flywheel": "visual_only",
        "causal_chain": "visual_only",
        "zoned_ecosystem": "visual_only",
        "data_flow": "visual_only",
        "state_transition": "visual_only",
        "conceptual_scene": "visual_only",
        "editorial_illustration": "visual_only",
        "brand_character_scene": "visual_only",
        "material_background": "visual_only",
        "complex_infographic": "visual_only"
      },
      "warnings": [
        "html_svg is visual-only; it cannot satisfy native-required objects."
      ],
      "errors": []
    }
  },
  "renderers": {
    "microsoft_powerpoint": {
      "available": false,
      "version": null,
      "command": null,
      "supports_pdf": false,
      "supports_png": false,
      "supports_readback": false
    },
    "libreoffice": {
      "available": false,
      "version": null,
      "command": null,
      "supports_pdf": false,
      "supports_png": false,
      "supports_readback": false
    },
    "keynote": {
      "available": false,
      "version": null,
      "command": null,
      "supports_pdf": false,
      "supports_png": false,
      "supports_readback": false
    }
  },
  "formats": {
    "html_render": true,
    "html_to_svg": true,
    "svg_render": false,
    "svg_embed": true,
    "pdf_to_png": true,
    "pptx_read": true,
    "pptx_write": true,
    "pptx_render": false,
    "image_generation": false
  },
  "fonts": {
    "installed": [],
    "required_missing": [
      "Aptos",
      "Noto Sans CJK SC",
      "Microsoft YaHei",
      "Source Han Serif SC",
      "Noto Serif CJK SC",
      "SimSun",
      "JetBrains Mono",
      "Consolas"
    ],
    "fallback_map": {
      "Aptos": "sans-serif",
      "Noto Sans CJK SC": "sans-serif",
      "Microsoft YaHei": "sans-serif",
      "Source Han Serif SC": "serif",
      "Noto Serif CJK SC": "serif",
      "SimSun": "serif",
      "JetBrains Mono": "monospace",
      "Consolas": "monospace"
    }
  },
  "features": {
    "available_builder_count": 3,
    "available_renderer_count": 0,
    "native_builder_available": true
  },
  "warnings": [
    "CAPABILITY_RENDERER_NOT_FOUND: no PowerPoint/LibreOffice renderer detected.",
    "CAPABILITY_REQUIRED_FONT_MISSING: one or more style fonts are missing.",
    "html_svg: html_svg is visual-only; it cannot satisfy native-required objects.",
    "officecli: officecli command not found."
  ],
  "errors": []
}
