{
  "schema_version": "1.0",
  "generated_at": "2026-07-16T12:00:00+08:00",
  "environment": {"os": "Darwin", "os_version": "25.0", "architecture": "arm64", "python": "3.12.4", "node": null, "java": null, "working_directory": "article-html-to-ppt", "containerized": false},
  "builders": {
    "pptxgenjs": {"available": false, "version": null, "command": null, "features": {"native_text": false, "native_table": false, "native_chart": false, "native_connector": false, "svg_embed": false, "speaker_notes": false, "theme": false, "slide_master": false, "readback": false}, "components": {}, "warnings": ["node missing"], "errors": []},
    "python_pptx": {"available": true, "version": "1.0.2", "command": "python", "features": {"native_text": true, "native_table": true, "native_chart": false, "native_connector": "partial", "svg_embed": false, "speaker_notes": false, "theme": "partial", "slide_master": "partial", "readback": true}, "components": {"metric_card": "full", "bar_chart": "partial", "process_flow": "partial", "ecosystem_map": "partial", "conceptual_scene": "visual_only"}, "warnings": [], "errors": []},
    "html_svg": {"available": true, "version": "python-stdlib-svg", "command": "python", "features": {"native_text": false, "native_table": false, "native_chart": false, "native_connector": false, "svg_embed": true, "speaker_notes": false, "theme": false, "slide_master": false, "readback": false}, "components": {"conceptual_scene": "visual_only"}, "warnings": ["visual only"], "errors": []}
  },
  "renderers": {
    "microsoft_powerpoint": {"available": false, "version": null, "command": null, "supports_pdf": false, "supports_png": false, "supports_readback": false},
    "libreoffice": {"available": false, "version": null, "command": null, "supports_pdf": false, "supports_png": false, "supports_readback": false}
  },
  "formats": {"html_render": false, "html_to_svg": true, "svg_render": false, "svg_embed": true, "pdf_to_png": false, "pptx_read": true, "pptx_write": true, "pptx_render": false, "image_generation": false},
  "fonts": {"installed": ["Aptos", "Noto Sans CJK SC"], "required_missing": [], "fallback_map": {}},
  "features": {"available_builder_count": 2, "available_renderer_count": 0, "native_builder_available": true},
  "warnings": ["CAPABILITY_RENDERER_NOT_FOUND"],
  "errors": []
}
