{
  "schema_version": "1.0",
  "generated_at": "2026-07-16T12:00:00+08:00",
  "environment": {"os": "Darwin", "os_version": "25.0", "architecture": "arm64", "python": "3.12.4", "node": null, "java": null, "working_directory": "article-html-to-ppt", "containerized": false},
  "builders": {
    "pptxgenjs": {"available": true, "version": "4.0.1", "command": "node", "features": {"native_text": "unknown", "native_table": "unknown", "native_chart": "unknown", "native_connector": "unknown", "svg_embed": "unknown", "speaker_notes": "unknown", "theme": "unknown", "slide_master": "unknown", "readback": "unknown"}, "components": {"metric_card": "unknown", "bar_chart": "unknown"}, "warnings": ["unknown support"], "errors": []},
    "python_pptx": {"available": false, "version": null, "command": null, "features": {"native_text": false, "native_table": false, "native_chart": false, "native_connector": false, "svg_embed": false, "speaker_notes": false, "theme": false, "slide_master": false, "readback": false}, "components": {}, "warnings": ["missing"], "errors": []},
    "html_svg": {"available": true, "version": "python-stdlib-svg", "command": "python", "features": {"native_text": false, "native_table": false, "native_chart": false, "native_connector": false, "svg_embed": true, "speaker_notes": false, "theme": false, "slide_master": false, "readback": false}, "components": {"metric_card": "visual_only"}, "warnings": ["visual only"], "errors": []}
  },
  "renderers": {
    "microsoft_powerpoint": {"available": true, "version": "16.99", "command": "Microsoft PowerPoint.app", "supports_pdf": true, "supports_png": true, "supports_readback": true},
    "libreoffice": {"available": false, "version": null, "command": null, "supports_pdf": false, "supports_png": false, "supports_readback": false}
  },
  "formats": {"html_render": false, "html_to_svg": true, "svg_render": false, "svg_embed": true, "pdf_to_png": true, "pptx_read": false, "pptx_write": true, "pptx_render": true, "image_generation": false},
  "fonts": {"installed": ["Aptos"], "required_missing": [], "fallback_map": {}},
  "features": {"available_builder_count": 2, "available_renderer_count": 1, "native_builder_available": false},
  "warnings": [],
  "errors": []
}
